{
  "$schema": "../schema/member.schema.json",
  "id": "tam",
  "name": "Đặng Trí Tâm",
  "role": "Backend Developer · Golang",
  "tagline": "Thợ đụng chính hiệu: đụng gì làm nấy.",
  "color": "#8cc9a0",
  "style": "developer",
  "bio": [
    "Lập trình viên backend làm chính với Go, hiện tự làm các dự án cá nhân và đang học năm 2 tại UIT (hệ vừa học vừa làm).",
    "Đưa một việc kèm hạn chót, miễn nó không đòi hỏi trình độ bậc thầy như vẽ một bức tranh hoàn mỹ hay thiết kế quy trình cho nhà máy điện hạt nhân, thì khả năng cao là việc đó sẽ xong."
  ],
  "education": [
    {
      "school": "Trường Đại học Công nghệ Thông tin – ĐHQG-HCM (UIT)",
      "degree": "Hệ vừa học vừa làm",
      "note": "Đang học năm 2"
    }
  ],
  "skillGroups": [
    { "label": "Ngôn ngữ", "items": ["Go", "JavaScript"] },
    { "label": "Database & hạ tầng", "items": ["PostgreSQL", "Redis", "Docker", "Pulumi"] },
    { "label": "Công cụ", "items": ["Git", "CI/CD", "Cloud"] },
    { "label": "Đụng thêm", "items": ["Frontend", "DevOps (cơ bản)"] }
  ],
  "works": [
    {
      "type": "project",
      "title": "TALES — trang giới thiệu team",
      "date": "2026",
      "summary": "Chính trang bạn đang xem: Next.js xuất web tĩnh, chuyển giữa các thành viên bằng state theo slug nên không tải lại trang, nội dung tách ra JSON có schema kiểm tra, ảnh tự tách nền bằng rembg (BiRefNet), GitHub Actions kiểm tra nội dung, xử lý ảnh và tự deploy lên GitHub Pages.",
      "tags": ["Next.js", "TypeScript", "Python", "GitHub Actions"],
      "links": [{ "label": "Mã nguồn", "url": "https://github.com/tristaamnee/tales" }],
      "featured": true
    }
  ],
  "socials": [
    { "platform": "github", "url": "https://github.com/tristaamnee" },
    { "platform": "email", "url": "mailto:tritam20082001@gmail.com" }
  ]
}
