{
  "$schema": "../schema/member.schema.json",
  "id": "member-2",
  "name": "Trần Thị B",
  "role": "UI/UX Designer",
  "tagline": "Thiết kế là kể chuyện bằng hình.",
  "color": "#f472b6",
  "bio": [
    "Giới thiệu ngắn về bản thân: bạn là ai, bạn làm gì trong team, điều gì khiến bạn hứng thú với công việc này."
  ],
  "stats": [
    {
      "value": "3+",
      "label": "Năm kinh nghiệm"
    },
    {
      "value": "120",
      "label": "Màn hình đã vẽ"
    },
    {
      "value": "12",
      "label": "Brand identity"
    }
  ],
  "skills": [
    "Figma",
    "Illustrator",
    "Design System",
    "Prototyping"
  ],
  "works": [
    {
      "type": "project",
      "title": "Redesign ứng dụng XYZ",
      "date": "2026",
      "summary": "Mô tả ngắn: dự án là gì, bạn đã đóng góp gì, kết quả ra sao.",
      "tags": [
        "UI",
        "UX Research"
      ],
      "featured": true
    },
    {
      "type": "project",
      "title": "Bộ nhận diện thương hiệu",
      "date": "2025",
      "summary": "Mô tả ngắn về dự án.",
      "tags": [
        "Branding"
      ]
    }
  ],
  "socials": [
    {
      "platform": "behance",
      "url": "https://www.behance.net/"
    },
    {
      "platform": "dribbble",
      "url": "https://dribbble.com/"
    }
  ]
}
